<?xml version="1.0" encoding="UTF-8"?>
<xs:schema xmlns:xs="http://www.w3.org/2001/XMLSchema">
    <xs:element name="DSSanPham">
        <xs:complexType>
            <xs:sequence>
                <xs:element name="Sanpham" maxOccurs="unbounded">
                    <xs:complexType>
                        <xs:sequence>
                            <xs:element name="id" type="xs:int" />
                            <xs:element name="name">
                                <xs:simpleType>
                                    <xs:restriction base="xs:string">
                                        <xs:minLength value="3" />
                                        <xs:maxLength value="50" />
                                    </xs:restriction>
                                </xs:simpleType>
                            </xs:element>
                            <xs:element name="Category_id">
                                <xs:simpleType>
                                    <xs:restriction base="xs:int">
                                        <xs:minExclusive value="0" />
                                        <xs:maxExclusive value="10" />
                                    </xs:restriction>
                                </xs:simpleType>
                            </xs:element>
                            <xs:element name="desscription">
                                <xs:simpleType >
                                    <xs:restriction base="xs:string">
                                        <xs:pattern value="[a-zA-Z0-9]{1,128}"/>
                                    </xs:restriction>
                                </xs:simpleType>
                            </xs:element>
                            <xs:element name="amount">
                                <xs:simpleType>
                                    <xs:restriction base="xs:int">
                                        <xs:minInclusive value="0" />
                                        <xs:maxInclusive value="9999" />
                                    </xs:restriction>
                                </xs:simpleType>
                            </xs:element>
                            <xs:element name="price">
                                <xs:simpleType>
                                    <xs:restriction base="xs:int">
                                        <xs:minInclusive value="100" />
                                    </xs:restriction>
                                </xs:simpleType>
                            </xs:element>
                            <xs:element name="size"/>
                            <xs:element name="image" >
                                <xs:complexType>
                                    <xs:simpleContent>
                                        <xs:extension base="xs:string">
                                            <xs:attribute name="type" use="optional">
                                                <xs:simpleType>
                                                    <xs:restriction base="xs:string">
                                                        <xs:enumeration value=".jpg"/>
                                                        <xs:enumeration value=".jepg"/>
                                                        <xs:enumeration value=".png"/>
                                                    </xs:restriction>
                                                </xs:simpleType>
                                            </xs:attribute>
                                        </xs:extension>
                                    </xs:simpleContent>
                                </xs:complexType>
                            </xs:element>
                            <xs:element name="date" type="xs:dateTime" minOccurs="0"  maxOccurs="unbounded"/>
                        </xs:sequence>
                    </xs:complexType>
                </xs:element>
            </xs:sequence>
        </xs:complexType> 
        
        <xs:unique name="unique_id">
            <xs:selector xpath=".//*"/>
            <xs:field xpath="id"/>
        </xs:unique>
    </xs:element>
</xs:schema>